[
  {
    "pattern_id": "BUR-93-P1",
    "stop_id": "BUR-01023",
    "sequence": 1,
    "is_first_stop": true,
    "is_last_stop": false,
    "updated_at": "2026-09-22T10:00:00Z"
  },
  {
    "pattern_id": "BUR-93-P1",
    "stop_id": "BUR-01024",
    "sequence": 2,
    "is_first_stop": false,
    "is_last_stop": true,
    "updated_at": "2026-09-22T10:00:00Z"
  }
]
